link,name,genre,director,year,appearance
https://kinobar.vip/11934-shestizaryadnyy-spasitel-v1.html,Шестизарядный спаситель,"Драмы, Боевики, Приключения, Фантастика, Вестерны, Фильмы 2016",Кирк Мюррэй,2016,28 февраля 2017
https://kinobar.vip/7053-zapadnyy-mir-1-sezon-5-v4.html,Мир дикого запада 1 сезон,"Сериалы, Триллеры, Фантастика, Вестерны","Джонатан Нолан, Джонни Кэмпбелл, Ричард Дж. Льюис",2016,7 декабря 2016
https://kinobar.vip/23921-yunye-titany-vpered-smotryat-kosmicheskiy-dzhem.html,"Юные Титаны, вперед! Смотрят Космический джэм","Комедии, Фильмы 2021, Боевики, Приключения, Мультфильмы, Фантастика, Семейный, Фэнтези, Спорт",Питер Райда Михаил,2021,13 июля 2021
https://kinobar.vip/25077-superzlodei-1-sezon.html,Суперзлодеи 1 сезон 1-13 серия,"Сериалы, Боевики, Мультфильмы, Фантастика, Фэнтези, Аниме",Мотонобу Хори,2021,25 ноября 2021
https://kinobar.vip/4555-kovboy-bibop-v1.html,Ковбой Бибоп,"Комедии, Боевики, Триллеры, Мультфильмы, Фантастика, Криминал, Аниме","Синичиро Ватанабэ, Хироюки Окиура",2001,21 ноября 2021
https://kinobar.vip/25050-proza-brodyachih-psov-vse-serii-po-poryadku.html,Проза бродячих псов (все серии по порядку),"Комедии, Сериалы, Боевики, Приключения, Мультфильмы, Фантастика, Детектив, Аниме",Такуя Игараси,2016,18 ноября 2021
https://kinobar.vip/24916-mastera-mecha-onlayn-progressiv-ariya-v-bezzvezdnoy-nochi.html,Мастера меча онлайн: Прогрессив. Ария в,"Фильмы 2021, Боевики, Приключения, Мультфильмы, Фантастика, Фэнтези, Скоро в кино, Аниме",Аяко Коуно,2021,1 ноября 2021
https://kinobar.vip/24729-kletki-za-rabotoy-temnaya-storona-1-sezon-1-13-seriya.html,Клетки за работой: Тёмная сторона 1 сезон 1-13,"Комедии, Сериалы, Боевики, Мультфильмы, Фантастика, Аниме",Хидэё Ямамото,2021,14 октября 2021
