link,name,genre,director,year,appearance
https://kinobar.vip/24466-presledovanie-2-sezon-1-3-seriya.html,Преследование 2 сезон 1-4 серия,"Сериалы, Драмы, Триллеры, Детектив, Криминал",Марк Эванс,2021,24 сентября 2021
https://kinobar.vip/24119-devyat-sovsem-neznakomyh-lyudey-1-sezon.html,Девять совсем незнакомых людей 1 сезон 1-8 серия,"Сериалы, Драмы, Триллеры, Детектив",Джонатан Левин,2021,22 сентября 2021
https://kinobar.vip/13292-mama-v4.html,мама!,"Драмы, Триллеры, Ужасы, Детектив, Фильмы 2017",Даррен Аронофски,2017,21 сентября 2021
https://kinobar.vip/24125-dezhurstvo-1-sezon.html,"Дежурство 1 сезон 1-5,6 серия","Сериалы, Драмы, Триллеры, Детектив, Криминал","Isabelle Sieb, Джеймс Стронг",2021,20 сентября 2021
https://kinobar.vip/1089-malholland-drayv-v1.html,Малхолланд Драйв,"Драмы, Триллеры, Детектив",Дэвид Линч,2001,19 сентября 2021
https://kinobar.vip/23952-syurrealisticheskaya-nedvizhimost-syurrieltory-1-sezon-12-seriya.html,Сюрреалистическая недвижимость / Сюрриэлторы 1,"Сериалы, Драмы, Триллеры, Фантастика, Фэнтези, Детектив","Данишка Эстерхази, Пол Фокс, Паоло Барзмен",2021,18 сентября 2021
https://kinobar.vip/23838-ohotnik-za-razumom-shvatka.html,Охотник за разумом. Схватка,"Фильмы 2021, Драмы, Биография, Детектив, Криминал, Новинки кино",Эмбер Роуз Сили,2021,16 сентября 2021
https://kinobar.vip/23860-slesher-4-sezon.html,"Слэшер 4 сезон 1-7,8 серия","Сериалы, Драмы, Триллеры, Ужасы, Детектив, Криминал","Крэйг Дэвид Уоллес, Фелипе Родригез, Адам МакДональд",2021,16 сентября 2021
https://kinobar.vip/977-zhutko-gromko-i-zapredelno-blizko-v2.html,Жутко громко и запредельно близко,"Драмы, Приключения, Детектив",Стивен Долдри,2011,11 сентября 2021
https://kinobar.vip/24103-moy-psiholog-mister-golub.html,Мой психолог — Мистер Голубь,"Комедии, Фильмы 2021, Драмы, Детектив",Янив Раз,2021,11 сентября 2021
https://kinobar.vip/7272-kontakt-v1.html,Контакт,"Драмы, Триллеры, Фантастика, Детектив, Фильмы про НЛО",Роберт Земекис,1997,9 сентября 2021
https://kinobar.vip/23898-femida-vidit-1-sezon-12-seriya.html,"Фемида видит 1 сезон 1-19,20 серия","Комедии, Сериалы, Драмы, Детектив","Никита Грамматиков, Ирина Бас",2021,9 сентября 2021
https://kinobar.vip/1508-revolver-1-v5.html,Револьвер,"Драмы, Триллеры, Детектив, Криминал",Гай Ричи,2005,5 сентября 2021
https://kinobar.vip/24311-kniga-duhov.html,Книга духов,"Драмы, Детектив, Фильмы 2020",Карло Хинтерманн,2020,5 сентября 2021
https://kinobar.vip/24272-chernyy-ostrov.html,Чёрный остров,"Фильмы 2021, Драмы, Триллеры, Детектив",Мигель Александр,2021,31 августа 2021
https://kinobar.vip/685-zodiak-v1.html,Зодиак,"Драмы, Триллеры, Детектив, Криминал, Фильмы, основанные на реальных событиях",Дэвид Финчер,2007,30 августа 2021
https://kinobar.vip/23904-chastnye-syschiki-5-sezon-1-seriya.html,Частные сыщики 5 сезон 1-8 серия,"Комедии, Сериалы, Драмы, Детектив, Криминал","Джеймс Дженн, Шон Пиллер, Келли Макин",2021,27 августа 2021
https://kinobar.vip/24099-klikbeyt-1-sezon.html,Кликбейт 1 сезон 1-8 серия,"Сериалы, Драмы, Триллеры, Детектив, Криминал",Брэд Андерсон,2021,26 августа 2021
https://kinobar.vip/24122-otkroy-glaza-1-sezon.html,Открой глаза 1 сезон 1-6 серия,"Сериалы, Драмы, Триллеры, Детектив","Анна Ядовская, Адриан Панек",2021,26 августа 2021
https://kinobar.vip/24135-rusalki-1-sezon.html,Русалки 1 сезон,"Сериалы, Драмы, Детектив",Александр Кириенко,2018,19 августа 2021
https://kinobar.vip/22769-zasuha-v1.html,Город тайн,"Фильмы 2021, Драмы, Триллеры, Детектив, Криминал",Роберт Коннолли,2021,19 августа 2021
https://kinobar.vip/24010-novyy-vishnevyy-vkus-1-sezon.html,Новый вишнёвый вкус 1 сезон 1-8 серия,"Сериалы, Драмы, Триллеры, Ужасы, Детектив","Gandja Monteiro, Джейк Шрейер, Мэтт Собель",2021,15 августа 2021
https://kinobar.vip/21963-gadalka-2-sezon-1-5-seriya-v1.html,"Гадалка 2 сезон 1-15,16 серия","Сериалы, Драмы, Триллеры, Детектив",Илья Казанков,2020,12 августа 2021
https://kinobar.vip/23939-severnye-vody-1-sezon-1-seriya.html,Северные воды 1 сезон 1-5 серия,"Сериалы, Драмы, Детектив",Эндрю Хэй,2021,12 августа 2021
https://kinobar.vip/24075-nesluchaynost-1-sezon-1-9-seriya.html,Неслучайность 1 сезон 1-9 серия,"Сериалы, Драмы, Триллеры, Детектив","Майк Баркер, Ниса Хардиман, Ротем Шамир",2021,12 августа 2021
https://kinobar.vip/24061-otzvuki.html,Отзвуки,"Драмы, Триллеры, Ужасы, Детектив, Фильмы 2020",Питер Уинтер,2020,9 августа 2021
https://kinobar.vip/23731-vneshnie-otmeli-2-sezon.html,Внешние отмели 2 сезон 1-10 серия,"Сериалы, Драмы, Приключения, Детектив","Джонас Пейт, Чери Ноулан, Валери Уайсс",2021,30 июля 2021
https://kinobar.vip/23582-istoriya-lizi-1-sezon-v1.html,История Лизи 1 сезон 1-8 серия,"Сериалы, Драмы, Триллеры, Ужасы, Детектив",Пабло Ларраин,2021,16 июля 2021
