link,name,genre,director,year,appearance
https://kinobar.vip/25660-zaslanec-iz-kosmosa-2-sezon-1-seriya.html,Засланец из космоса 2 сезон 1-2 серия,"Комедии, Сериалы, Драмы, Фантастика, Детектив","Роберт Данкан МакНил, Джей Чандрашекхар, Шеннон Коли",2021,3 февраля 2022
https://kinobar.vip/25512-zhenschina-v-dome-naprotiv-devushki-v-okne-1-sezon.html,Женщина в доме напротив девушки в окне 1 сезон,"Комедии, Сериалы, Драмы, Триллеры, Детектив",Майкл Леманн,2022,31 января 2022
https://kinobar.vip/25665-trevozhnye-lyudi-1-sezon-1-6-seriya.html,Тревожные люди 1 сезон 1-6 серия,"Комедии, Сериалы, Драмы, Детектив, Криминал",Феликс Хернгрен,2021,27 января 2022
https://kinobar.vip/24755-otec-sergiy-1-sezon.html,"Сергий против нечисти 1 сезон 1-5,6 серия","Комедии, Сериалы, Фэнтези, Детектив",Кирилл Кузин,2021,14 января 2022
https://kinobar.vip/23832-tayna-sen-trope.html,Тайна Сен-Тропе,"Комедии, Фильмы 2021, Детектив, Криминал, Новинки кино",Николя Бенаму,2021,8 января 2022
https://kinobar.vip/25437-ubiystvo-v-gnezde-fazana.html,Убийство в «Гнезде фазана»,"Комедии, Фильмы 2021, Детектив, Криминал, Российское кино",Алексей Смирнов,2021,30 декабря 2021
https://kinobar.vip/25424-48-chasov-1-sezon-1-16-seriya.html,48 часов 1 сезон 1-16 серия,"Комедии, Сериалы, Детектив",Егор Баринов,2021,27 декабря 2021
https://kinobar.vip/25325-pod-pricelom.html,Под прицелом,"Комедии, Фильмы 2021, Детектив, Криминал","Мануэль Кросби, Даррен Кнапп",2021,21 декабря 2021
https://kinobar.vip/24673-vinovnaya-storona-1-sezon.html,Виновная сторона 1 сезон 1-10 серия,"Комедии, Сериалы, Детектив, Криминал","Стэйси Мухаммад, Трент О'Доннелл",2021,9 декабря 2021
https://kinobar.vip/24865-vne-sebya-1-sezon.html,"Вне себя 1 сезон 1-7,8 серия","Комедии, Сериалы, Триллеры, Детектив","Александр Дулерайн, Клим Козинский",2021,9 декабря 2021
https://kinobar.vip/25034-dzhek-i-london-1-sezon-1-7-seriya.html,Джек и Лондон 1 сезон 1-12 серия,"Комедии, Сериалы, Детектив",Александр Итыгилов мл.,2022,24 ноября 2021
https://kinobar.vip/25050-proza-brodyachih-psov-vse-serii-po-poryadku.html,Проза бродячих псов (все серии по порядку),"Комедии, Сериалы, Боевики, Приключения, Мультфильмы, Фантастика, Детектив, Аниме",Такуя Игараси,2016,18 ноября 2021
https://kinobar.vip/24092-rokovoy-patrul-3-sezon.html,Роковой патруль 3 сезон 1-10 серия,"Комедии, Сериалы, Драмы, Боевики, Фантастика, Детектив","Крис Мэнли, Гарри Жиержиан, Дермотт Даунс",2021,12 ноября 2021
https://kinobar.vip/24970-doktor.html,Доктор,"Комедии, Фильмы 2021, Боевики, Триллеры, Детектив, Криминал",Нельсон Дилипкумар,2021,8 ноября 2021
https://kinobar.vip/24774-balabol-5-sezon-1-8-seriya.html,"Балабол 5 сезон 1-19,20 серия","Комедии, Сериалы, Детектив",Владимир Мельник,2021,30 октября 2021
https://kinobar.vip/2070-dom-monstr-v1.html,Дом-монстр,"Комедии, Мультфильмы, Семейный, Фэнтези, Детектив",Гил Кинан,2006,24 октября 2021
https://kinobar.vip/24208-ubiystva-v-odnom-zdanii-1-sezon.html,Убийства в одном здании 1 сезон 1-10 серия,"Комедии, Сериалы, Детектив, Криминал","Джеми Бэббит, Шерин Дабис, Джиллиан Робеспьер",2021,19 октября 2021
https://kinobar.vip/24709-ohotnik-za-dezertirami-1-sezon-1-6-seriya.html,Охотник за дезертирами 1 сезон 1-6 серия,"Комедии, Сериалы, Драмы, Детектив, Азиатские сериалы",Хан Джун-хи,2021,11 октября 2021
https://kinobar.vip/24695-ubiystva-v-odnom-zdanii-2-sezon.html,Убийства в одном здании 2 сезон,"Комедии, Сериалы, Детектив, Криминал","Джеми Бэббит, Шерин Дабис, Джиллиан Робеспьер",2021,10 октября 2021
https://kinobar.vip/23758-vo-tme-3-sezon.html,Во тьме /В темноте 3 сезон 1-13 серия,"Комедии, Сериалы, Драмы, Детектив, Криминал","Брайан Дэннели, Дэвид Гроссман, Стивен К. Цутида",2021,7 октября 2021
https://kinobar.vip/24299-urok-demokratii-1-sezon-1.html,Урок демократии 1 сезон 1-8 серия,"Комедии, Сериалы, Драмы, Детектив","Денис Гуляр, Вячеслав Попов",2021,25 сентября 2021
https://kinobar.vip/24374-skubi-du-i-truslivyy-hrabrec.html,Скуби-Ду и трусливый Храбрец,"Комедии, Фильмы 2021, Приключения, Мультфильмы, Семейный, Фэнтези, Ужасы, Детектив",Сесилия Аранович,2021,13 сентября 2021
https://kinobar.vip/24103-moy-psiholog-mister-golub.html,Мой психолог — Мистер Голубь,"Комедии, Фильмы 2021, Драмы, Детектив",Янив Раз,2021,11 сентября 2021
https://kinobar.vip/23898-femida-vidit-1-sezon-12-seriya.html,"Фемида видит 1 сезон 1-19,20 серия","Комедии, Сериалы, Драмы, Детектив","Никита Грамматиков, Ирина Бас",2021,9 сентября 2021
https://kinobar.vip/23904-chastnye-syschiki-5-sezon-1-seriya.html,Частные сыщики 5 сезон 1-8 серия,"Комедии, Сериалы, Драмы, Детектив, Криминал","Джеймс Дженн, Шон Пиллер, Келли Макин",2021,27 августа 2021
https://kinobar.vip/24084-filin-1-sezon-1-4-seriya.html,Филин 1 сезон 1-12 серия,"Комедии, Сериалы, Детектив","Дмитрий Аверин, Александр Строев",2021,26 августа 2021
https://kinobar.vip/24159-kak-izbavitsya-ot-predkov.html,Как избавиться от предков,"Комедии, Триллеры, Детектив, Фильмы 2019",Джей Лоуи,2019,25 августа 2021
https://kinobar.vip/23686-taynoe-obschestvo-mistera-benedikta-1-sezon.html,Тайное общество мистера Бенедикта 1 сезон 1-4,"Комедии, Сериалы, Приключения, Семейный, Детектив","Джеймс Бобин, Шеннон Коли",2021,11 июля 2021
https://kinobar.vip/21994-million-melochey-3-sezon-v4.html,"Миллион мелочей 3 сезон 1-17,18 серия","Комедии, Сериалы, Мелодрамы, Драмы, Детектив","Джеймс Гриффитс, Нина Лопес-Коррадо, Ричард Дж. Льюис",2020,11 июня 2021
https://kinobar.vip/23125-detektiv-iz-chaynatauna-3-v1.html,Детектив из Чайнатауна 3,"Комедии, Фильмы 2021, Боевики, Детектив",Чэнь Сычэн,2021,1 июня 2021
https://kinobar.vip/23453-missiya-vypolnima.html,Миссия выполнима,"Комедии, Фильмы 2021, Мелодрамы, Боевики, Детектив",Ким Хён-джу,2021,20 апреля 2021
https://kinobar.vip/22133-oboroten-v1.html,Оборотень,"Комедии, Ужасы, Детектив, Фильмы 2020",Джим Каммингс,2020,7 апреля 2021
https://kinobar.vip/20019-prishelec-postoyalec-1-sezon-v3.html,Засланец из космоса 1 сезон 1-10 серия,"Комедии, Сериалы, Драмы, Фантастика, Детектив","Шеннон Коли,Дженнифер Фанг,Дэвид Добкин",2021,1 апреля 2021
https://kinobar.vip/20431-utinye-istorii-3-sezon-1-2-seriya-v5.html,Утиные истории 3 сезон 1-22 серия,"Комедии, Сериалы, Боевики, Приключения, Мультфильмы, Фантастика, Семейный, Фэнтези, Детектив","Мэттью Хэмфрис, Тэннер Джонсон, Джейсон Зурек",2020,20 марта 2021
https://kinobar.vip/23143-skubi-du-pri-dvore-korolya-artura-v1.html,Скуби-Ду при дворе короля Артура,"Комедии, Фильмы 2021, Боевики, Приключения, Мультфильмы, Семейный, Фэнтези, Детектив","Максвелл Атомс, Кристина Сотта, Мельхиор Цвиер",2021,21 февраля 2021
https://kinobar.vip/22302-chastnye-syschiki-4-sezon-1-seriya-v3.html,Частные сыщики 4 сезон 1-12 серия,"Комедии, Сериалы, Драмы, Детектив, Криминал","Джеймс Дженн, Шон Пиллер, Келли Макин",2020,5 февраля 2021
https://kinobar.vip/23009-gruppa-izucheniya-angliyskogo-v1.html,Группа изучения английского,"Комедии, Драмы, Детектив, Фильмы 2020",Ли Джон-пхиль,2020,2 февраля 2021
