link,name,genre,director,year,appearance
https://kinobar.vip/16845-karmen-sandiego-1-sezon-v3.html,Кармен Сандиего 1 сезон 1-9 серия,"Сериалы, Приключения, Мультфильмы, Семейный, Детектив",Неизвестно,2019,16 февраля 2019
https://kinobar.vip/17077-princessa-lebed-7-korolevskoe-prikrytie-v4.html,Принцесса Лебедь 7: Королевское прикрытие,"Комедии, Приключения, Мультфильмы, Семейный, Мюзикл, Детектив, Фильмы 2017",Ричард Рич,2017,8 февраля 2019
https://kinobar.vip/16717-lemoni-sniket-33-neschastya-3-sezon-v2.html,Лемони Сникет: 33 несчастья 3 сезон 1-7 серия,"Комедии, Сериалы, Драмы, Приключения, Семейный, Детектив","Барри Зонненфельд, Бо Уэлш, Марк Палански",2019,1 января 2019
https://kinobar.vip/16156-morskie-dyavoly-rubezhi-rodiny-1-2-seriya-v2.html,Морские дьяволы. Рубежи Родины 1-24 серия,"Сериалы, Боевики, Приключения, Детектив, Криминал","Александр Картохин, Максим Бриус",2017,29 декабря 2018
https://kinobar.vip/15589-gogol-strashnaya-mest-v1.html,Гоголь. Страшная месть,"Приключения, Триллеры, Детектив, Новинки кино, Российское кино, Фильмы 2018",Егор Баранов,2018,19 октября 2018
https://kinobar.vip/16075-priderzhi-tmu-v1.html,Придержи тьму,"Драмы, Приключения, Триллеры, Детектив, Новинки кино, Фильмы 2018",Джереми Солнье,2018,8 октября 2018
https://kinobar.vip/14889-blich-v2.html,Блич,"Боевики, Приключения, Фантастика, Детектив, Новинки кино, Фильмы 2018",Синсуке Сато,2018,25 сентября 2018
https://kinobar.vip/15402-propovednik-3-sezon-hd-v3.html,Проповедник 3 сезон,"Сериалы, Драмы, Приключения, Фэнтези, Детектив","Эван Голдберг, Сет Роген, Майкл Словис",2018,27 августа 2018
https://kinobar.vip/15942-vernut-iz-mertvyh-vse-serii-po-poryadku-v1.html,Вернуть из мертвых (все серии по порядку),"Сериалы, Драмы, Приключения, Триллеры, Фэнтези, Детектив","Майкл Кэтлман, Пол Шапиро, Гай Норман Би",2003,30 июля 2018
https://kinobar.vip/15640-12-obezyan-4-sezon-v1.html,"12 обезьян 4 сезон 1-10,11 серия","Сериалы, Драмы, Приключения, Триллеры, Фантастика, Детектив","Дэвид Гроссман, Терри Маталас, Магнус Мартенс",2018,7 июля 2018
https://kinobar.vip/15624-pod-pokrovom-nochi-v1.html,Под покровом ночи,"Приключения, Мультфильмы, Семейный, Фэнтези, Детектив","Адриа Гарсия, Виктор Мальдонадо",2007,9 июня 2018
https://kinobar.vip/15563-sfinksy-severnyh-vorot-1234-seriya-v1.html,"Сфинксы северных ворот 1,2,3,4 серия","Сериалы, Приключения, Детектив",Олег Штром,2018,28 мая 2018
https://kinobar.vip/14131-gogol-viy-v1.html,Гоголь. Вий,"Драмы, Приключения, Детектив, Новинки кино, Российское кино, Фильмы 2018",Егор Баранов,2018,26 мая 2018
