link,name,genre,director,year,appearance
https://kinobar.vip/25503-ne-obmani-12-seriya.html,"Не обмани 1,2 серия","Фильмы 2021, Мелодрамы, Детектив, Российское кино",Алексей Праздников,2021,10 января 2022
https://kinobar.vip/25437-ubiystvo-v-gnezde-fazana.html,Убийство в «Гнезде фазана»,"Комедии, Фильмы 2021, Детектив, Криминал, Российское кино",Алексей Смирнов,2021,30 декабря 2021
https://kinobar.vip/25292-taezhnyy-detektiv-12-seriya.html,"Таежный детектив 1,2 серия","Фильмы 2021, Сериалы, Детектив, Российское кино",Валентин Донсков,2021,12 декабря 2021
https://kinobar.vip/24944-yaponskiy-bog.html,Японский Бог,"Драмы, Детектив, Криминал, Российское кино, Фильмы 2019",Александр Басов,2019,5 ноября 2021
https://kinobar.vip/24796-poslednyaya-milaya-bolgariya.html,Последняя «Милая Болгария»,"Фильмы 2021, Детектив, Российское кино",Алексей Федорченко,2021,21 октября 2021
https://kinobar.vip/24767-memorio.html,MEMORIO,"Триллеры, Детектив, Российское кино, Фильмы 2019",Вадим Гордт,2019,17 октября 2021
https://kinobar.vip/24336-shifr-3-sezon-1-4-seriya.html,"Шифр 3 сезон 1-7,8 серия","Сериалы, Детектив, Российское кино, Фильмы 2018",Вера Сторожева,2021,9 сентября 2021
https://kinobar.vip/20970-mayor-grom-chumnoy-doktor-v2.html,Майор Гром: Чумной Доктор,"Фильмы 2021, Боевики, Приключения, Детектив, Криминал, Новинки кино, Российское кино",Олег Трофим,2021,13 мая 2021
https://kinobar.vip/22357-posle-chernobylya.html,После Чернобыля,"Фильмы 2021, Триллеры, Ужасы, Детектив, Новинки кино, Российское кино","Игорь Кинько, Максим Литвинов, Данил Алексеев",2021,30 апреля 2021
