link,name,genre,director,year,appearance
https://kinobar.vip/24671-kod-na-milliard-dollarov-1-sezon-1-4-seriya.html,Код на миллиард долларов 1 сезон 1-4 серия,"Сериалы, Драмы, Триллеры, Биография, Детектив, Криминал",Роберт Тальхайм,2021,9 октября 2021
https://kinobar.vip/23838-ohotnik-za-razumom-shvatka.html,Охотник за разумом. Схватка,"Фильмы 2021, Драмы, Биография, Детектив, Криминал, Новинки кино",Эмбер Роуз Сили,2021,16 сентября 2021
https://kinobar.vip/22303-bos-zhiv-ili-mertv-1-sezon-1-seriya-v1.html,Бос: жив или мёртв 1 сезон 1-9 серия,"Сериалы, Триллеры, Биография, Детектив, История",Пулкит,2017,11 ноября 2020
https://kinobar.vip/20728-rozhdennaya-revolyuciey-vse-serii-po-poryadku-v2.html,Рожденная революцией (все серии по порядку),"Сериалы, Биография, Детектив, История, Криминал",Григорий Кохан,1974,10 мая 2020
https://kinobar.vip/15538-gorod-lzhi-v5.html,Город лжи,"Драмы, Триллеры, Биография, Детектив, Криминал, Фильмы 2018",Брэд Фурман,2018,11 декабря 2019
https://kinobar.vip/18264-medichi-poveliteli-florencii-3-sezon-v3.html,"Медичи: Повелители Флоренции 3 сезон 1-7,8 серия","Сериалы, Мелодрамы, Драмы, Триллеры, Биография, Детектив, История","Кристиан Дюге,Серджо Мимика-Геззан,Джон Кассар",2019,5 декабря 2019
https://kinobar.vip/15951-professor-i-bezumec-1-v3.html,Игры разумов,"Драмы, Триллеры, Биография, Детектив, Новинки кино, Фильмы 2019",Фарад Сафиниа,2019,3 июня 2019
https://kinobar.vip/16017-lizzi-v3.html,Месть Лиззи Борден,"Драмы, Триллеры, Биография, Детектив, Криминал, Фильмы 2018",Крэйг Уилльям Макнейлл,2018,16 марта 2019
https://kinobar.vip/13852-vinchester-dom-kotoryy-postroili-prizraki-v1.html,"Винчестер. Дом, который построили призраки","Триллеры, Биография, Фэнтези, Ужасы, Детектив, Новинки кино, Фильмы 2018","Майкл Спириг, Питер Спириг",2018,6 мая 2018
